{
  "id": "os2.x86.pm",
  "os_family": "os2",
  "os_floor": "Exact OS/2 floor to qualify",
  "architecture": "x86",
  "abi": "os2-native",
  "executable_format": "LX-or-profile-selected",
  "gui": "presentation-manager",
  "terminal": "cli+tui",
  "stage": "future",
  "status": "planned",
  "gui_exception": null,
  "runtime": "native system APIs",
  "delivery": {
    "single_entrypoint": true,
    "single_file_goal": true,
    "zero_extraction_goal": true,
    "app_bundle": false
  },
  "evidence": [],
  "qualification_notes": "Exact toolchain/API floor and runtime qualification remain required."
}
